category,diff_line,county,state
,"“While it’s concerning to see positive COVID cases in a communal setting like this, the company has a planned response and is proactively working to test and protect other crew members,” said Erika Lautenbach, Whatcom County Health Department Director.",whatcom,Washington
,"“The sick crew member is receiving great care at PeaceHealth and the Health Department is working with the company and our public health and healthcare partners to quickly and comprehensively address this outbreak.” The U.S. Coast Guard, U.S. Centers for Disease Control and the Port of Bellingham have all been notified and are engaged.",whatcom,Washington
,"As this is a current and rapidly evolving situation, there will be no further information available this evening.",whatcom,Washington
,Whatcom County Unified Command or the Whatcom County Health Department will provide updates as more information is available.,whatcom,Washington
,"### Bellingham,5 W09A G 9ir8a2r2d5 S-4tr0e0e5t 1500 North State Street Bellingham, WA 98225-4551 360.778.6000 | FAX 360.778.6001 360.778.6100 | FAX 360.778.6101 WhatcomCountyHealth www.whatcomcounty.us/health WhatcomCoHealth",whatcom,Washington
,USDA and its Federal partners have programs that can be used to provide immediate and long-term assistance to rural communities affected by the COVID-19 outbreak.,pottawattamie,Iowa
,"These programs can support recovery efforts for rural residents, businesses and communities through: ¢ technical, training, and management assistance; ¢ financial assistance; and ¢ state and local assistance.",pottawattamie,Iowa
,This resource matrix organizes funding opportunities identified in stimulus bills and other federal resources that can help support rural America.,pottawattamie,Iowa
,Opportunities are categorized by customer and assistance type.,pottawattamie,Iowa
,"For more information on the immediate actions USDA is taking to respond to COVID-19, visit usda.gov/coronavirus.",pottawattamie,Iowa
,"To learn about USDA’s COVID-19 response for rural communities, visit rd.usda.gov/coronavirus.",pottawattamie,Iowa
,"For the latest news from the CDC on COVID-19, visit coronavirus.gov.",pottawattamie,Iowa
,"NEW: Resources to address substance use disorder (SUD) and the opioid crisis, visit Rural Community Toolbox ruralcommunitytoolbox.org.4) Rural Customer For-Profit Businesses: Corporations, Limited Liability Companies, sole proprietorships, Lenders, etc.",pottawattamie,Iowa
,"COVID-19 Federal Response Resource Matrix OoO (oy) Technical Assistance/ Training/Management ¢ USDA Agriculture Marketing Service: FAQ’s: Related to COVID-19 impact on the Fruit and Vegetable industry SBA: COVID-19 Small Bus Guidance and Loan Resources Small Business Development Centers: Small Business Resources Service Corps of Retired Executives (SCORE): Small Business Resource Hub ¢ SCORE: Remote mentoring Benefits.gov Coronavirus resources ¢ DOL: Families First Coronavirus Response Act Notice-FAQS FDA-COVID-19-Related Guidance Documents for Industry, FDA Staff, and Other Stakeholders ¢ NEW: FEMA Planning Starter Kit for Returning to Full Operations Is es Financial General State/ Assistance Local Resources USDA Rural Development Business _ | * Guidance for Businesses and and Industry Loan Guarantee Employers to Plan and Respond USDA Farm Service Agency: Coronavirus.Gov-Breakdown Microloan Programs of Assistance SBA Paycheck Protection Program USDA Multi-Family Housing Direct SBA COVID-19 Economic Inju Loan COVID-19 Fact Sheet Disaster Loan NEW: SBA Federal Contractin SBA: COVID-19 Small Bus.",pottawattamie,Iowa
,Guidance for Small Businesses.,pottawattamie,Iowa
,Guidance and Loan Resources impacted by COVID-19 DOL: National Health Emergenc NEW: SBA-Economic Inju Dislocated Worker Grants Disaster Loan (EIDL) and EIDL Advance for qualified DOL: Wage and Hour small businesses and Division: COVID-19 and the.,pottawattamie,Iowa
,"U.S. agricultural businesses American Workplace IRS Coronavirus Tax Relief and Economic Impact Payments USDA RD Rural Energy for American Program-Renewable Energy & Energy Efficiency Fact Sheet USDA RD Single Family Home Loan Guarantees Fact Sheet NEW: USDA RD Business and Industry CARES Act Program NEW: National Institute of Standards and Technology Manufacturing Extension Partnership Grants usda.gov/coronavirus4) Rural Customer Agricultural Producers and Ranchers: COVID-19 Federal Response Resource Matrix OoO ony Technical Assistance/ Training/Management ¢ USDA Continues Focus on Service During COVID-19 Outbreak ¢ H-2A Visa Program COVID-19 Related Resources ¢ Farm Loan Discovery Tool ¢ Farm Service Agency: Guaranteed Loans-Lender Toolkit ¢ USDA Agriculture Marketing Service: FAQ’s: Related to COVID-19 impact on the Fruit and Vegetable industry IgSo5 Financial Assistance Farmers.gov: Funding for Farmers Ranchers, and forest landowners Farm Loan Discovery Tool USDA Farm Service Agency: Microloan Programs Find your local Natural Resources Conservation Service office SBA Paycheck Protection Program IRS Coronavirus Tax Relief and Economic Impact Payments USDA Rural Energy for American Program-Renewable Energy & Energy Efficiency Fact Sheet NEW: USDA Coronavirus Food Assistance Program NEW: USDA RD Business and Industry CARES Act Program NEW: USDA Agricultural Marketing Service (AMS) Overview of Local & Regional Food Funding ry General State/ Local Resources Farmers.gov Latest Updates and Resources AMS-USDA Farmers to Families Food Box (part of Coronavirus Farm Assistance Program) NEW: US Dept.",pottawattamie,Iowa
,"of Veterans Affairs-COVID-19 Response NEW: USDA FSA Expands Set-Aside Loan for Customers Impacted NEW: SBA-Economic Injury Disaster Loan (EIDL) and EIDL Advance for qualified small businesses and U.S. agricultural businesses usda.gov/coronavirusA Rural Customer Government Entities: State, County or local governments COVID-19 Federal Response Resource Matrix OoO (ial Technical Assistance/ Training/Management USDA Foreign Agricultural Service (FAS) Data and Analysis USDA FAS Overseas Office Directory USDA FAS Programs FNS Coronavirus Website National Park Service Public Health Update FEMA: Coronavirus (COVID-19) Response FEMA Coronavirus Rumor Control Interim Guidance for Emergency Medical Services (EMS) Systems and 911 Public Safety Answering Points: CDC FCC: Service Providers Pledge(s) Cybersecurity & Infrastructure Security Agency: Critical Infrastructure Guidance NEW: US Dept.",pottawattamie,Iowa
,"of Veterans Affairs Support of States NEW: FEMA Planning Starter Kit for Returning to Full Operations IgSo5 Financial Assistance USDA Food and Nutrition Service (FNS) Response to COVID-19 Meals to You: Baylor Collaborative on Hunger and Poverty (FNS Announcement) USDA Rural Development: COVID-19 Resource Website USDA Rural Development ReConnect Program VA Homeless Housing Assistance Substance Abuse and Mental Health Services Administration (SAMHSA): Coronavirus Resources Emergency Medical Services EMS.gov: Coronavirus/COVID-19 Resources HUD: COVID-19 Resources and Fact Sheets EPA: Water Utility Resources DOJ: Office of Community Oriented Policing Services (COPS) DOJ: Office of Justice Programs (OJP) DOJ: Office on Violence Against Women (OVW USDA RD Water and Environmental Programs COVID-19 Fact Sheet NEW: US Economic Development Administration CARES Act Recovery Assistance NEW: EDA Public Works and Economic Adjustment Assistance Programs including CARES Act Funding KZ General State/ Local Resources ¢ U.S. Interagency Council on Homelessness (USICH) - COVID-19 Resources FCC: Home Network Tips for the Coronavirus Pandemic Appalachian Regional Commission: Real-Time Data Maps Spread of Coronavirus at Regional Level USA.Gov State Specific COVID-19 Resources: Links to each State from this site Food and Nutrition Service: Response to COVID-19 (WIC/SNAP etc) USDA RD Community Facilities Direct Loan & Grant Deferral Fact Sheet CDC Resources for Parks and Recreational Facilities NEW: CDC Communication Toolkit for Migrants, Refugees, and Other Limited English Proficient Populations NEW: NOAA Fisheries Coronavirus Funding-those with coastal and marine fishery participants usda.gov/coronavirusCOVID-19 Federal Response Resource Matrix A OoO oN SO} yj cnn IsSoy 7 Rural Technical Assistance/ Financial General State/ Customer Training/Management Assistance Local Resources Nonprofits: USDA National Institute of Food and_ | * USDA Rural Development.",pottawattamie,Iowa
,Distance |» FNS: How to become a Summer Economic Dev.,pottawattamie,Iowa
,"Corps., Agriculture Coronavirus (COVID-19) | Learning and Telemedicine (DLT Site Sponsor universities, schools, Resources SBA COVID-19 Economic Inju DOE COVID-19 Information and libraries, faith-based FNS: How to become a Summer Site Disaster Loan Resources for Schools and School organizations, etc.",pottawattamie,Iowa
,U.S. Economic Development Personnel : Sponsor Administration U.S. Interagency Council on US Dent of Labor: The National FEMA: COVID-19 Response-How Homelessness (USICH) - Banc otke lobe Prowan (NEI Jobs Program (NFJP) can | help?,pottawattamie,Iowa
,COVID-19 Resources Career Services and Training Grants | « Food and Nutrition Service: CDC: Information for Healthcare and Housing Grants Response to COVID-19 Professionals NIFA Grant: Rapid Response to_ (WIC/SNAP etc) Novel Coronavirus Impacts across US Dept.,pottawattamie,Iowa
,of Health & Human Food and Agricultural Systems FCC-COVID-19 Services: Child Care and USDA RD Community Facilities Telehealth Program Development Fund Direct Loan & Grant Deferral.,pottawattamie,Iowa
,AMS-USDA Farmers to Families FNS: COVID-19 Congregate Meal Fact Sheet Food Box (part of Coronavirus Waivers & Q&As on Summer Meal Te Nationa’ ncowment for Farm Assistance Program) ; ; “ati ; e Arts- ct Grants Delivery Using Existing Authority for Organizations == USDA Multi-Family Housing Direct for Returning to Full Operations Administration CARES Act CARES Act NEW: SBA and Treasury Recovery Assistance Department Announce $10 Billion NEW: EDA Public Works and for CDFls to Participate in the Economic Adjustment Assistance Paycheck Protection Program Programs including CARES Act Fundin Cooperatives USDA Cooperative Programs Site: SBA Paycheck Protection Program USDA RD Funded Rural Publications and Research SBA COVID-19 Economic Injury Cooperative Development Disaster Loan Center listing Farm Service Agency: Loans to USDA Multi-Family Housing Direct For-Profit Farm Cooperatives Loan COVID-19 Fact Sheet usda.gov/coronavirusCOVID-19 Federal Response Resource Matrix A OoO oN SO} yj cnn IsSoy 7 Rural Technical Assistance/ Financial General State/ Customer Training/Management Assistance Local Resources Individuals/Households: |* USDA Coronavirus Disease ¢ Food Finder: Connects families to e FEMA: COVID-19 Response-How (COVID-19) feeding sites can | help?,pottawattamie,Iowa
,¢ ChooseMyPlate: Food Planning ¢ USDARD Single Family Guaranteed USDA National Hunger Hotline during the Coronavirus Pandemic Housing Loan Program Website Foods and Nutrition Service: ¢ VA: Novel Coronavirus Disease ¢ USDA Meals for Kids Site Finder Find Meals for Kids COVID-19 - DOL: Wage and Hour Division: US Dept of Health and Human COVID-19: Social Insurance and COVID-19 and the American Services: Administration for Other Income-Support Options for Workplace Community Living (Older Adults Those Unable to Work - VA: Housing Assistance and People with Disabilities) Workplace Leave and - VA: Homeless Housing Assistance Medicare.gov's COVID-1 g Unemployment Insurance for information for beneficiaries vi ¢ IRS Coronavirus Tax Relief and individuals Affected by COVID-12 Economic Impact Payments Consumer Financial Protection Food Safety and Inspection Service: Bureau Protecting Finances Common questions about Food * USDARD Rural Home Loans (Direct | — Information/Resources - Program) Fact Sheet 7 Safety and COVID-19 a USAJobs hiring to help respond - US.,pottawattamie,Iowa
,Dept of Health and Human * USDA Multi-Family Housing Direct to COVID-19 national emergenc Services: American Sign Language | 10a0 COVID-19 Fact Sheet ¢ NEW: National Park Service Find COVID-19 Resource links ° HUD Single Family Home your Park-Operating Status ¢ NEW: Coronavirus and Mortgage Resource Other Disability Focused Federal Resources usda.gov/coronavirusCOVID-19 Federal Response Resource Matrix A OoO oN SO} yj cnn IsSoy 7 Rural Technical Assistance/ Financial General State/ Customer Training/Management Assistance Local Resources Health: Hospitals ¢ Substance Abuse and Mental Health | * Centers for Medicaid and HHS-CMS Long-Term Care Nursing Services Administration SAMHSA: Medicare Services Homes Telehealth and Telemedicine Coronavirus (COVID=19) - HHS Awards $100 Million to Health | ool kit ¢ Centers for Medicaid and Centers for COVID-19 Response Coronavirus Disease (COVID-19) Medicare Services - VA Public Health Response Frequently Asked Questions — | * CDC-COVID-19 Fact Sheet to COVID-19 Federal Office of Rural Health Policy - Medicare Telehealth Frequent * HHS COVID-19 Tribal fundin eee eae .,pottawattamie,Iowa
,nvironmental Hea Asked Questions ¢ IRS Coronavirus Tax Relief and_ uckerascem ‘fee bor Teste Sciences Worker Training Program/ ¢ HHS Partnership Office-Preventive Economic Impact Payments Protecting Yourself Resources Practices and FAQs for Faith-based_ ¢ USDA RD Community Facilities (also En Espafol) and Community Leaders Direct Loan & Grant Deferral ¢ HHS-What do Older Adults Fact Sheet and People wan Disabilities ¢ USDA Rural Development.,pottawattamie,Iowa
,Distance Need to Know’?,pottawattamie,Iowa
,"Learning and Telemedicine (DLT) ¢ Coronavirus Treatment Acceleration Deadline July 13th Program (CTAP * FCC-COVID-19 Telehealth Program usda.gov/coronavirusCOVID-19 Federal Response Resource Matrix A OOO as EM leSo5 cy Rural Technical Assistance/ Financial General State/ Customer Training/Management Assistance Local Resources Federally recognized USDA Food and Nutrition Service * Food Distribution Program on Housing and Urban Development Tribes, or (FNS) Response to COVID-19 Indian Reservations (FDPIR (HUD) COVID-19 Resources and Tribal organizations Intertribal Agriculture Council: ¢ USDA Rural Development.",pottawattamie,Iowa
,Fact Sheets ReConnect Program a ULONVID- 19 KESOUrCES ; Cra.,pottawattamie,Iowa
,VVater UUllyY RESOUrCeS COVID-19 Resources USDA Rural Development.,pottawattamie,Iowa
,Distance EPA: Water Utility Resources Indian Health Service: Coronavirus Learnina and Telemedicine (DLT DOJ: Office of Community Oriented COVID-19 Institute of Museum and Library Policing Services (COPS ¢ FEMA: Coronavirus (COVID-19) Services: Grants to expand digital DOJ: Office of Justice Programs ResKAnse network access etc.,pottawattamie,Iowa
,(OJP) ¢ HUD Native American Programs: COVID-19 Resources for Indian IHBG and ICDBG funds DOJ: Office on Violence Against Country: National Congress of Indian Health Services: Increased Women (OVW) American Indians funding in multiple programs.,pottawattamie,Iowa
,"FCC-COVID-19 Telehealth Program HUD COVID-19 Resources and Fact | * Bureau of Indian Affairs: Indian ; ; , Sheets Affairs Operation of Indian Programs USDA Multi-Family Housing Direct.",pottawattamie,Iowa
,views Loan COVID-19 Fact Sheet $8 billion set-aside for tribal nations Federal Reserve Bank of from the Coronavirus Relief Fund NEW: HUD Office of Native Minneapolis COVID-19 to use for expenditures incurred American Programs Recovery.,pottawattamie,Iowa
,Resources for Indian Count due to the COVID-19 public health Programs-FAQS updated US Dept.,pottawattamie,Iowa
,of Health & Human emergency Resources: Office of Child Care- SBA: COVID-19 Small Bus NEW: SBA and Treasu .,pottawattamie,Iowa
,Guidance and Loan Resources Department Announce $10 Billion Child Care and Development Fund Ne si USDA RD Community Facilities Direct | fOr CGDFls to Participate in the Native American Finance Officers Loan & Grant Deferral Fact Sheet Paycheck Protection Program Association (NAFOA) USDA RD Water and Environmental.,pottawattamie,Iowa
,| » NEW: Coronavirus and NEW: FEMA Planning Starter Kit Programs COVID-19 Fact Sheet Other Disability Focused for Returning to Full Operations era vs Economic.,pottawattamie,Iowa
,"pevelo ment Federal Resources Recovery Aesisianca ~~ NEW: USDA Agricultural Marketin NEW: NOAA Fisheries Coronavirus | Setvice (AMS) Overview of Local Funding-those with coastal and & Regional Food Fundin marine fishery participants NEW: EDA Public Works and Economic Adjustment Assistance Programs including CARES Act Fundin usda.gov/coronavirusGlossary of Terms CARES Act: Coronavirus Aid, Relief, and Economic Security Act FAQS: Frequently Asked Questions Data ¢ NEW: Census Bureau Launches COVID-19 Data Hub ¢ ESRI Impact Planning for COVID-19: Community Indicators related to decision making around COVID-19 Impact ¢ Tableau Data Visualization Hub (looking at data from multiple perspectives ¢ COVID-19 Data Reposito ¢ COVID-19 Model by Johns Hopkins Universit ¢ John Hopkins Corona Virus Resource Center - COVID Trackin ¢ COVID-19 Coronavirus Pandemic — world aggregate of cases and by country breakdown ¢ COVID-19 Data Center from Data World NEW: Denotes a new resource link added since last version 07/07/2020.",pottawattamie,Iowa
,usda.gov/coronavirusAdditional Federal Agency COVID-19 Resources Acronym | Definition Centers for Disease Control and Prevention (CDC Centers for Medicare and Medicaid CHCO Chief Human Capital Officers Council CFPB Consumer Financial Protection Bureau (CFPB CNCS Corporation for National and Community Service (CNCS DAU [Defense Acquistion Universiy USDA [DepartmentofAgrcuture (USDA) DoD __DepartmentofDefense (DoD) DOE Department of Energy (DOE) HHS [Department of Heath and Human Services (HHS) DHS [Departmentof Homeland Security (DHS) HUD [Department of Housing and Urban Development (HUD) Control Division pos Department of State (DOS) ODNI Director of National inteligence EPA [Environmental Protection Agency (EPA) FAA [Federal Aviation Administration (FAA) BOP Federal Bureau of Prisons FCC Federal Communications Commission (FCC) FDIC Federal Deposit Insurance Corporation (FDIC) ED Federal Student Aid Federal Trade Commission (FTC) Last Updated 07/07/20 Acronym | Definition FDA __|FoodandDnugAdministaton (FDA) GSA____|General Services Administration (GSA) IRS_[infemal Revenue Senice (RS) MSPG Mert Systems Protecion Board (SPB) NA (Nationalarctives National Park Service NREL National Renewable Energy Laboratory National Science Foundation (NSF) NMCPHC Navy and Marine Corps Public Health Center USNRC Nuclear Regulatory Commission Office of the Assistant Secretary for Preparedness and Response OoPM Office of Personnel Management Small Business Administration (SBA) U.S. Fire Administration USNORHCOM|U.S.,pottawattamie,Iowa
,"Northern Command USPTO U.S. Patent and Trademark Office (USPTO) USSOCOM S. I I d ces USCIS U.S. Special Operations Comman Washington Headquarters Service USDA is an equal opportunity provider, employer, and lender.",pottawattamie,Iowa
,usda.gov/coronavirus,pottawattamie,Iowa
