sentence_num,diff_line,county,state
1603,Limit unnecessary travel.,cambridge,Massachusetts
1604,Try to visit grocery stores and pharmacies when they are less crowded.,cambridge,Massachusetts
1605,"If you are sick with COVID-19, please follow the CDC’s guidelines to protect the people you live with and the community.",cambridge,Massachusetts
1606,Physical Distancing is Not Social Isolation Physical distancing is about keeping a safe distance from other people—it does not mean social isolation.,cambridge,Massachusetts
1607,"You can be social through social media, video chats/conferences, or by phone.",cambridge,Massachusetts
1608,You can also write letters or cards.,cambridge,Massachusetts
1609,"Checking on friends, family, and neighbors is a great way to stay connected and be supportive of others who may be feeling alone or isolated.",cambridge,Massachusetts
1610,Physical distancing does not mean you cannot leave your home.,cambridge,Massachusetts
1611,"When going outside, be sure to avoid crowds and maintain a safe separation of at least 6 feet from others.",cambridge,Massachusetts
1612,Walking outside is a good way to exercise and prevent stress.,cambridge,Massachusetts
1613,"Remember, if you walk or exercise with someone who is not a household member, keep 6-feet apart from each other.",cambridge,Massachusetts
1614,"Resources on Physical Distancing Information on COVID-19 for Survivors, Communities, and DV/SA Programs by Futures Without Violence What Cambridge Employers Can Do About Physical Distancing For workers who must be physically present in a workplace, such as health care and long-term care workers, public safety personnel, pharmacy, and supermarket employees, employers can help ensure their safety by: Strongly discouraging older employees (age 60+) and those with chronic health conditions from coming into the workplace.",cambridge,Massachusetts
1615,"Following recommendations for social distancing, such as keeping an approximate 6-foot distance from other people and recognizing that this will not be achievable in all settings.",cambridge,Massachusetts
1616,Ensuring that soap/sanitizers are available and that participants engage in proper handwashing and hand-hygiene practices.,cambridge,Massachusetts
1617,Ensuring that cleaning and disinfection guidelines for COVID-19 are followed.,cambridge,Massachusetts
1618,"$j(window).load(function () { //Check to see if any FAQ needed to be forced open if ($j("".accordion .force"").length > 0) { $j("".accordion .force"").each(function () { //close all faqs in the current accordion $j(this).parent().accordion('option', { active: false }); //Show the answer of the forced faq $j(this).next('div').show(); }) } else { //Get the hash value in the url var FaqID = window.location.hash; //Check if value came back if (FaqID != """") { //Replace the lead hashtag so that just the id value is left FaqID = FaqID.replace('#', ''); //Check is the value is alpha-numeric and 32 characters long if (FaqID.match(""[a-zA-Z0-9]*$"")[0] != """" && FaqID.match(""[a-f0-9]*$"")[0].length == 32 && FaqID.replace('#', '').length == 32) { var foundFAQ = false; var count = 0; //Search for all the questions until we an id that matches the given id $j('.accordion > h3').each(function () { if ($j(this).attr(""id"") == FaqID) { foundFAQ = true; return false; } count++; }); if (foundFAQ) { //collapse all FAQs $j('.accordion').accordion('option', { active: false }); //Expand the question that was found $j('.accordion').accordion(""option"", ""active"", count); //reverse scroll setTimeout(function() { window.scrollBy(0,-60); }, 150); } } } //If there is more than 1 FAQ, inactivate all of them except for the first one else if ($j("".faq > .accordion"").length > 1) { $j("".faq:not(:first-of-type) .accordion"").accordion('option', { active: false }); } } }); Taking Care of Yourself & Loved Ones How can I support my mental health/wellness & access recovery services?",cambridge,Massachusetts
1619,The outbreak of COVID-19 may be stressful for people and communities.,cambridge,Massachusetts
1620,Fear and anxiety about a disease can be overwhelming and cause strong emotions in adults and children.,cambridge,Massachusetts
1621,It is important to remember that everyone reacts differently to stressful situations and that taking care of your mental health is not a sign of weakness.,cambridge,Massachusetts
1622,Taking care of your emotional health during an emergency will help you think clearly and react to the urgent needs to protect yourself and your loved ones.,cambridge,Massachusetts
1623,Here are some things you can do to support yourself.,cambridge,Massachusetts
1624,You can learn more on the CDC site.,cambridge,Massachusetts
1625,Take care of your body.,cambridge,Massachusetts
1626,"Take deep breaths, stretch, or meditate.",cambridge,Massachusetts
1627,"Try to eat healthy, well-balanced meals, exercise regularly, get plenty of sleep, and avoid alcohol and drugs.",cambridge,Massachusetts
1628,Avoid excessive exposure to media coverage of COVID-19.,cambridge,Massachusetts
1629,It can be upsetting to hear about the crisis repeatedly.,cambridge,Massachusetts
1630,Try to do enjoyable activities and return to normal life as much as possible and check for updates between breaks.,cambridge,Massachusetts
1631,Connect with others.,cambridge,Massachusetts
1632,Share your concerns and how you are feeling with a friend or family member.,cambridge,Massachusetts
1633,Maintain healthy relationships.,cambridge,Massachusetts
1634,Seek help when needed.,cambridge,Massachusetts
1635,"If distress impacts activities of your daily life for several days or weeks, talk to a counselor, doctor, or clergy member.",cambridge,Massachusetts
1636,You can also contact the Substance Abuse and Mental Health Services Administration (SAMHSA) helpline at 1-800-985-5990 or text TalkWithUs to 66746 to connect with a trained crisis counselor.,cambridge,Massachusetts
1637,"For Spanish speakers, call 1-800-985-5990 and press ""2"" or text Hablanos to 66746.",cambridge,Massachusetts
1638,"Español Resources on Mental Health, Recovery Services, and Mental Wellness Grayken Center for Addiction (Boston Medical Center): COVID-19 Recovery Resources Mental Health America: Mental Health And COVID-19 – Information And Resources National Alliance on Mental Illness: COVID-19 (Coronavirus) Information and Resources Virtual Support Meetings Find a list of virtual recovery meetings by time of day and day of week Additional recovery meeting information, online apps, and more can be found on the Grayken Center for Addiction website here.",cambridge,Massachusetts
1639,How you can talk to children about COVID-19 Reassure your children that they are safe.,cambridge,Massachusetts
1640,Try to keep information simple and remind them that health and school officials are working hard to keep everyone safe and healthy.,cambridge,Massachusetts
1641,Let them know it is ok if they feel upset.,cambridge,Massachusetts
1642,Share with them how you deal with your own stress so that they can learn how to cope from you.,cambridge,Massachusetts
1643,You can also help your children find positive ways to express feelings such as fear and sadness.,cambridge,Massachusetts
1644,"Sometimes engaging in a creative activity, such as playing and drawing, can help this process.",cambridge,Massachusetts
1645,Children may feel relieved if they can express and communicate their disturbing feelings in a safe and supportive environment.,cambridge,Massachusetts
1646,More Tips Be a role model.,cambridge,Massachusetts
1647,"Take breaks, get plenty of sleep, exercise, and eat well.",cambridge,Massachusetts
1648,Connect with your friends and family members online or over the phone.,cambridge,Massachusetts
1649,Rely on your social support system.,cambridge,Massachusetts
1650,Get children into a handwashing habit.,cambridge,Massachusetts
1651,"Also remind them to cough or sneeze into a tissue or their elbow, then throw the tissue into the trash.",cambridge,Massachusetts
1652,Avoid language that might blame others and lead to stigma.,cambridge,Massachusetts
1653,"Remember that viruses can make anyone sick, regardless of a person’s race or ethnicity.",cambridge,Massachusetts
1654,Avoid making assumptions about who might have COVID-19.,cambridge,Massachusetts
1655,Resources for Parents and Children Local Resources for Cambridge Families (Cambridge Let’s Talk!),cambridge,Massachusetts
1656,"https://letstalkcambridge.org/covid-19-local-resources/ Talking with children about Coronavirus Disease (CDC) https://www.cdc.gov/coronavirus/2019-ncov/community/schools-childcare/talking-with-children.html $j(window).load(function () { //Check to see if any FAQ needed to be forced open if ($j("".accordion .force"").length > 0) { $j("".accordion .force"").each(function () { //close all faqs in the current accordion $j(this).parent().accordion('option', { active: false }); //Show the answer of the forced faq $j(this).next('div').show(); }) } else { //Get the hash value in the url var FaqID = window.location.hash; //Check if value came back if (FaqID != """") { //Replace the lead hashtag so that just the id value is left FaqID = FaqID.replace('#', ''); //Check is the value is alpha-numeric and 32 characters long if (FaqID.match(""[a-zA-Z0-9]*$"")[0] != """" && FaqID.match(""[a-f0-9]*$"")[0].length == 32 && FaqID.replace('#', '').length == 32) { var foundFAQ = false; var count = 0; //Search for all the questions until we an id that matches the given id $j('.accordion > h3').each(function () { if ($j(this).attr(""id"") == FaqID) { foundFAQ = true; return false; } count++; }); if (foundFAQ) { //collapse all FAQs $j('.accordion').accordion('option', { active: false }); //Expand the question that was found $j('.accordion').accordion(""option"", ""active"", count); //reverse scroll setTimeout(function() { window.scrollBy(0,-60); }, 150); } } } //If there is more than 1 FAQ, inactivate all of them except for the first one else if ($j("".faq > .accordion"").length > 1) { $j("".faq:not(:first-of-type) .accordion"").accordion('option', { active: false }); } } }); Additional Resources MBTA COVID-19 Updates & Information Reducing Stigma and Building Resilience Nursing Home Family Resource Line Massachusetts Dept.",cambridge,Massachusetts
1657,"of Public Health COVID-19 Long Term Care Facility Staffing Team Intake Broad Institute COVID-19 Rapid Testing Pilot Program Information Wash Your Hands to Protect Yourself & Your Community Printable Fact Sheets Scraping from https://www.cambridgema.gov/covid19/Reopening Reopening Cambridge The City of Cambridge and Commonwealth of Massachusetts are working to safely reopen the economy, get people back to work, and ease social restrictions while minimizing the health impacts of COVID-19.",cambridge,Massachusetts
1658,"Information on plans, guidelines, and guidance for different sectors of the economy will be available here and updated often.",cambridge,Massachusetts
1659,The City of Cambridge will release further information on City-specific orders that will supplement the State’s recommendations when necessary.,cambridge,Massachusetts
1660,"Cambridge businesses planning to reopen must adhere to all Massachusetts regulations, in addition to any additional guidance issued by the City.",cambridge,Massachusetts
1661,"Interested in learning which Cambridge businesses are opening, offer outdoor dining, etc?",cambridge,Massachusetts
1662,"View Business List Updates (8/7/20) Governor Baker announced that Step Two of Phase III of the Commonwealth’s reopening plan has been postponed indefinitely (7/2/20) Phase III of Reopening Massachusetts Set to Begin on July 6, including gyms and fitness centers, museums and cultural venues, casinos and tour buses.",cambridge,Massachusetts
1663,Gov.,cambridge,Massachusetts
1664,Baker also announced revised gathering order.,cambridge,Massachusetts
1665,"(6/27/20) Emergency face covering order amended for summer months (6/25/20) Commonwealth of Massachusetts releases Initial Fall School Reopening Guidance (6/24/20) Cambridge Basketball Courts, Playgrounds, Tot Lots, and Water Play Structures to Reopen on Monday, June 29 (6/22/20) City of Cambridge Announces Street Changes to Increase Outdoor Dining Options (6/19/20) Step Two of Phase II of Reopening Massachusetts Set to Begin on June 22, including Indoor Table Service at Restaurants.",cambridge,Massachusetts
1666,"(6/16/20) Cambridge Public Health Department shares Guidance for Cambridge Business Managers Regarding Local Board of Health Reporting for COVID-19 (6/14/20) City of Cambridge departments to offer in-person services by appointment only beginning week of June 15 (6/6/20) Applications for Temporary Extension of Licensed Premises to Outdoor Area Due to COVID-19 in Cambridge are now available (6/6/20) Baker-Polito Administration Initiates Transition to Second Phase of Four-Phase Approach (6/1/20) Governor Baker Issues Executive Order in Advance of Phase II (5/29/20) Safety Standards and Checklists for Restaurants and Operators of Lodgings from the State have been posted under Phase 2 on the City's Reopening page (5/24/20) A new City of Cambridge Contact List for Reopening is now available, providing staff contact information for members of the public to reach out to with questions/help reopening their establishment (5/20/20) City of Cambridge releases Amended Temporary Emergency Construction Order (5/20/20) Read a message from the Cambridge City Manager to Cambridge Business Owners asking them to delay the opening of office spaces until at least June 1 (5/18/20) Cambridge Officials Reviewing State Plan as City Finalizes Reopening Strategy (5/18/20) Baker-Polito Administration Initiates Transition to First Phase of Four-Phase Approach (5/18/20) Governor Baker releases Reopening MA Report (5/11/20) Baker-Polito Administration Announces Four-Phase Approach to Reopening and Publishes Mandatory Workplace Safety Standards Sector-Specific Plans & Guidelines Below is not an exhaustive list and more detailed information from the Commonwealth of Massachusetts can be found here.",cambridge,Massachusetts
1667,"Phase 1 Manufacturing - Eligible to Reopen May 18, 2020 Eligible to reopen May 18, 2020 View Safety Standards for Manufacturing (Mass.gov) View Full Business List by category and reopening date (Mass.gov) View City of Cambridge Contact List for Reopening by category showing who to contact in which department for questions/help reopening your establishment Higher Education - Eligible to Reopen May 25, 2020 Higher education institutions began repopulating laboratory and/or clinical settings that may already be accustomed to following strict protocols for infection control.",cambridge,Massachusetts
1668,"In addition, small numbers of students, staff and faculty may return to campus in this phase as-needed to help prepare for repopulation across future phases.",cambridge,Massachusetts
1669,Learn more.,cambridge,Massachusetts
1670,"View Full Business List by category and reopening date (Mass.gov) View City of Cambridge Contact List for Reopening by category showing who to contact in which department for questions/help reopening your establishment Places of Worship - Eligible to Reopen May 18, 2020 Eligible to reopen on May 18, 2020.",cambridge,Massachusetts
1671,"View Safety Standards for Places of Worship (Mass.gov) View Full Business List by category and reopening date (Mass.gov) View City of Cambridge Contact List for Reopening by category showing who to contact in which department for questions/help reopening your establishment Car Washes - Eligible to Reopen May 25, 2020 Eligible to reopen May 25, 2020 View Safety Standards for Car Washes(Mass.gov) View Full Business List by category and reopening date (Mass.gov) View City of Cambridge Contact List for Reopening by category showing who to contact in which department for questions/help reopening your establishment Construction - Phased Reopening Begins in Cambridge May 25, 2020 Phased Reopening Begins in Cambridge on May 25, 2020 View Safety Standards for Construction (Mass.gov) View Full Business List by category and reopening date (Mass.gov) View City of Cambridge Contact List for Reopening by category showing who to contact in which department for questions/help reopening your establishment The City of Cambridge will expand currently allowed construction activity in the City in four phases*: Phase 1, beginning May 25, will add site safety prep work for projects previously permitted by Inspectional Services (ISD) and Public Works (DPW).",cambridge,Massachusetts
1672,"Forthcoming amendments to the City’s Temporary Emergency Construction Order issued on March 18 will modify the definition of essential construction to include work associated with COVID-19 restaurant modification needed to allow them to safely reopen; Phase 2, beginning on June 1, will add horizontal construction, city building projects, 100% affordable housing developments, larger buildings (over 25,000 square feet) previously permitted by ISD or DPW; Phase 3, beginning on June 15, will add all remaining existing construction previously permitted by ISD and DPW; Phase 4a, beginning on June 22, will add new permits for horizontal construction, roof, solar, siding, asbestos, and trade permits including plumbing, gas, mechanical, sheet metal, electrical and sprinkler.",cambridge,Massachusetts
1673,"Permits may be submitted, and pre-reviews will occur at any time, but permits will not be formally accepted or issued until this date; and Phase 4b, beginning June 29, will add new Building Permits (addition/alteration, new construction, demolition).",cambridge,Massachusetts
1674,"Permits may be submitted, and pre-reviews will occur at any time, but permits will not be formally accepted or issued until this date.",cambridge,Massachusetts
1675,"*Updated June 16, 2020.",cambridge,Massachusetts
1676,"Important City Guidelines & Information: City of Cambridge Amended Temporary Emergency Construction Order (PDF) Links to documents to download and post at sites: Handwashing signage Stay Home When Sick signage English Spanish Massachusetts Compliance Attestation poster General Retail - Eligible to Reopen May 25, 2020 Eligible to reopen May 25, 2020 Retail (such as clothing stores, toy stores, jewelry stores, nurseries and garden centers that don’t sell food products, adult use cannabis stores) For curbside pickup and delivery only.",cambridge,Massachusetts
1677,"View Full Business List by category and reopening date (Mass.gov) View City of Cambridge Contact List for Reopening by category showing who to contact in which department for questions/help reopening your establishment Hair Salons / Barbershops - Eligible to Reopen May 25, 2020 Eligible to reopen May 25, 2020 View Safety Standards for Hair Salons and Barbershops (Mass.gov) View Full Business List by category and reopening date (Mass.gov) View City of Cambridge Contact List for Reopening by category showing who to contact in which department for questions/help reopening your establishment Important City Information: Read the City of Cambridge Order Rescinding the Temporary Emergency Order by the Commissioner of Public Health and City Manager to Close All Tanning, Nail Salons, Barber Shops, etc.",cambridge,Massachusetts
1678,"Laboratories - Eligible to Reopen May 25, 2020 Eligible to reopen May 25, 2020 View Safety Standards for Laboratories (Mass.gov) View Full Business List by category and reopening date (Mass.gov) View City of Cambridge Contact List for Reopening by category showing who to contact in which department for questions/help reopening your establishment Pet Grooming - Eligible to Reopen May 25, 2020 Eligible to reopen May 25, 2020 View Safety Standards for Pet Grooming Services(Mass.gov) View Full Business List by category and reopening date (Mass.gov) View City of Cambridge Contact List for Reopening by category showing who to contact in which department for questions/help reopening your establishment Office Spaces - Eligible to Reopen May 25, 2020; Delay until June 1 Requested in Cambridge Eligible to reopen May 25, 2020; delay until June 1 requested in Cambridge View Safety Standards for Office Spaces(Mass.gov) View Full Business List by category and reopening date (Mass.gov) View City of Cambridge Contact List for Reopening by category showing who to contact in which department for questions/help reopening your establishment Important City Information: Read a message from the Cambridge City Manager to Cambridge Business Owners asking them to delay the opening of office spaces until at least June 1 $j(window).load(function () { //Check to see if any FAQ needed to be forced open if ($j("".accordion .force"").length > 0) { $j("".accordion .force"").each(function () { //close all faqs in the current accordion $j(this).parent().accordion('option', { active: false }); //Show the answer of the forced faq $j(this).next('div').show(); }) } else { //Get the hash value in the url var FaqID = window.location.hash; //Check if value came back if (FaqID != """") { //Replace the lead hashtag so that just the id value is left FaqID = FaqID.replace('#', ''); //Check is the value is alpha-numeric and 32 characters long if (FaqID.match(""[a-zA-Z0-9]*$"")[0] != """" && FaqID.match(""[a-f0-9]*$"")[0].length == 32 && FaqID.replace('#', '').length == 32) { var foundFAQ = false; var count = 0; //Search for all the questions until we an id that matches the given id $j('.accordion > h3').each(function () { if ($j(this).attr(""id"") == FaqID) { foundFAQ = true; return false; } count++; }); if (foundFAQ) { //collapse all FAQs $j('.accordion').accordion('option', { active: false }); //Expand the question that was found $j('.accordion').accordion(""option"", ""active"", count); //reverse scroll setTimeout(function() { window.scrollBy(0,-60); }, 150); } } } //If there is more than 1 FAQ, inactivate all of them except for the first one else if ($j("".faq > .accordion"").length > 1) { $j("".faq:not(:first-of-type) .accordion"").accordion('option', { active: false }); } } }); Phase 2 Beer gardens/breweries/wineries/distilleries (with seated food service) - Eligible to Reopen June 8, 2020 View Safety Standards for Restaurants (Mass.gov) View Full Business List by category and reopening date (Mass.gov) View City of Cambridge Contact List for Reopening by category showing who to contact in which department for questions/help reopening your establishment Important Information & Documents Temporary Extension of Licensed Premises to Outdoor Area Due to COVID-19 Application (City of Cambridge) Order Clarifying the Progression of the Commonwealth's Phased Workplace Re-Opening Plan and Authorizing Certain Re-Open Preparations at Phase II Workplaces Alcoholic Beverages Control Commission Advisory Regarding Local Licensing Authorities' Approval of Outdoor Seating Alcoholic Beverages Control Commission Advisory Regarding Guidelines for Extension of Premises to Patio and Outdoor Areas Child and youth serving programs - Eligible to Reopen June 8, 2020 On June 1, 2020, the Massachusetts Department of Early Education and Care (EEC) released the Minimum Requirements for Health and Safety, which sets forth the minimum requirements that programs must meet in order to reopen.",cambridge,Massachusetts
1679,"The minimum requirements apply to all child and youth serving programs, including child care programs regulated by EEC, recreational camps regulated by DPH, and municipal or recreational youth programs not traditionally licensed as camps that are seeking to operate during the phased plan of Reopening Massachusetts.",cambridge,Massachusetts
1680,Note: Residential camps and other overnight stays are not permitted to open until further notice.,cambridge,Massachusetts
1681,Learn more.,cambridge,Massachusetts
1682,"Important Information & Documents Massachusetts Child and Youth Serving Programs Reopen Approach -Minimum Requirements for Health and Safety (Mass.gov) Massachusetts Department of Early Education and Care Reopen Approach - FAQs (Mass.gov) Driving and flight schools - Eligible to Reopen June 8, 2020 Behind the wheel training.",cambridge,Massachusetts
1683,"View Full Business List by category and reopening date (Mass.gov) View City of Cambridge Contact List for Reopening by category showing who to contact in which department for questions/help reopening your establishment Funeral Homes - Eligible to Reopen June 8, 2020 40% capacity limit; one service at a time in the facility.",cambridge,Massachusetts
1684,"View Full Business List by category and reopening date (Mass.gov) View City of Cambridge Contact List for Reopening by category showing who to contact in which department for questions/help reopening your establishment Important Information & Documents: Read a message from the Cambridge City Manager to Cambridge Funeral Home Directors Higher education (students, staff and faculty for limited purposes) - Eligible to Reopen June 8, 2020 Higher education institutions may begin to allow students, staff and faculty to return to campus for the limited purposes of permitting students to complete a degree, program, or prerequisite for employment, or other similar requirement for completion, for summer youth programming including athletic facilities, and any necessary supporting services.",cambridge,Massachusetts
1685,Learn more.,cambridge,Massachusetts
1686,"View Full Business List by category and reopening date (Mass.gov) View City of Cambridge Contact List for Reopening by category showing who to contact in which department for questions/help reopening your establishment In home installations - Eligible to Reopen June 8, 2020 Non construction related – e.g., carpet installation, home theaters, security systems.",cambridge,Massachusetts
