sentence_num,diff_line,county,state
2666,"“By continuing to provide a Temporary Emergency Shelter for Cambridge residents experiencing homelessness, we will help prevent the spread of COVID-19 among our most vulnerable residents,” said Dr. Assaad Sayah, Commissioner of Public Health for the City of Cambridge.",cambridge,Massachusetts
2667,"“The more we can do to keep all residents safely distanced, regardless of where they call home, the greater chance we have to prevent increased illness due to this epidemic.” As this new initiative gets underway, the City will be creating a dedicated webpage, phone number, and email address to respond to community questions or concerns.",cambridge,Massachusetts
2668,"For more information and updates on COVID-19, please visit the City’s dedicated information page: https://www.cambridgema.gov/covid19.",cambridge,Massachusetts
2669,"Scraping from https://www.cambridgema.gov/news/detail.aspx?path=/sitecore/content/home/cpl/aboutus/newsandannouncements/2020/08/finefreepilot Cambridge Public Library Launches Pilot to Eliminate Overdue Fines and Fees August 10, 2020 CAMBRIDGE, MA, August 10, 2020 – – The City of Cambridge is pleased to announce a pilot program at the Cambridge Public Library to eliminate overdue fines for the late return/renewal of materials and the elimination of loss/damaged item fees for children's and young adult's materials.",cambridge,Massachusetts
2670,The elimination of Library fines will ensure equitable access to the great resources offered by the Library.,cambridge,Massachusetts
2671,"""The Cambridge Public Library is a critical source for books and online resources for our residents,” said Louis A. DePasquale, Cambridge City Manager.",cambridge,Massachusetts
2672,"“Now more than ever, we need to ensure that all members of the public have easy access to our library services.” Cambridge Public Library has long been fine free for children’s and young adult materials.",cambridge,Massachusetts
2673,The new pilot will extend that policy to late adult materials and to lost or damaged children’s and young adult materials.,cambridge,Massachusetts
2674,The Library has not been assessing any fines during the COVID-19 health crisis.,cambridge,Massachusetts
2675,The one-year pilot will officially begin when library services return to normal post-COVID to allow for a review period.,cambridge,Massachusetts
2676,Research has shown that low-income families identify fines as a barrier to their use of libraries and that there is no significant difference in overdue rates between libraries that charged fines and those that did not.,cambridge,Massachusetts
2677,Fines and fees also disproportionately impact low-income families and neighborhoods.,cambridge,Massachusetts
2678,"In January 2020, fines and fees in excess of $10 led to over 5,700 patrons being blocked from library use in Cambridge.",cambridge,Massachusetts
2679,"“Our public libraries serve a vital role for our residents, particularly for our vulnerable communities,"" said Cambridge Mayor Sumbul Siddiqui, “We know that these fines provide a barrier to low-income families and disproportionally affect low-income neighborhoods.",cambridge,Massachusetts
2680,"By removing these fines, I am hopeful that all of our residents can enjoy the magic of books at Cambridge public libraries without the fear of overdue fines.” “Our strategic plan calls on us to reduce barriers to access and take intentional action to create more equitable outcomes for the community members we serve,” stated Dr. Maria McCauley, Director of Libraries.",cambridge,Massachusetts
2681,"“I am excited that the Library, with the leadership of the City Council and City Manager, is embarking on this significant step in support of access, equity and inclusion.” The Library will continue to assess and collect fees for lost or damaged items from the adult collection and fines specifically related to our agreements with other libraries outside of Cambridge, such as the Commonwealth Catalog and Interlibrary Loan programs.",cambridge,Massachusetts
2682,"Scraping from https://www.cambridgema.gov/news/detail.aspx?path=/sitecore/content/home/cpl/aboutus/newsandannouncements/2020/08/checkouttechnologybeginningaugust10 Checkout Library Technology Beginning August 10 August 08, 2020 Cambridge, MA, August 7, 2020 ---- Cambridge Public Library will begin providing Chromebook Laptops for checkout through contactless holds pickup service on August 10, 2020.",cambridge,Massachusetts
2683,This service is in keeping with CPL’s commitment to expand access to technology and other library resources during the COVID-19 health crisis.,cambridge,Massachusetts
2684,"“Too many people in our community lack access to computers and connectivity in a time when such access is required more urgently than ever,” said Reinhard Engels, Manager of Technology and Innovation for the Cambridge Public Library.",cambridge,Massachusetts
2685,“This is the first step in our Takeout Technology program.,cambridge,Massachusetts
2686,"More Chromebooks and other devices, such as mobile hotspots for internet access, will be made available soon.” When the program launches, patrons will be able to borrow technology for up to two weeks with a one-time renewal if there are no existing holds for that type of device.",cambridge,Massachusetts
2687,"Items available for checkout include: four different models of Chromebooks, a charging cable, mouse and carrying case.",cambridge,Massachusetts
2688,"“The City is committed to addressing digital equity issues in Cambridge, and this new program is one example of how we are seeking to support residents during this ongoing pandemic,” said Louis A. DePasquale.",cambridge,Massachusetts
2689,"“The Takeout Technology program builds on the City’s ongoing digital equity efforts, including our sponsorship program that will provide home internet connections to over 400 qualified Cambridge Public School families.",cambridge,Massachusetts
2690,"I want to thank Cambridge Public Library staff for developing this important initiative.” Patrons will be able to request technology by calling the Main Library at 617-349-4040, providing their library card number, selecting their preferred device model, and scheduling a pickup time.",cambridge,Massachusetts
2691,"Technology can be returned in the Oversized Items bin during our Contactless Pickup service hours, Monday-Wednesday 1:30-7 p.m. and Thursday-Saturday 9:30 a.m.-4 p.m. at the Main Library, 449 Broadway.",cambridge,Massachusetts
2692,"“We know that many residents need access to technology for career development, job searches, family assistance and educational and recreational pursuits.” said Director of Libraries, Dr. Maria McCauley, “We are excited to launch checkout technology that will help residents.",cambridge,Massachusetts
2693,"Patrons who need help getting started, or some assistance with navigating the device may call 617-349-4040 or email library staff at library@cambridgema.gov to set up a One-on-One Tech Help session.",cambridge,Massachusetts
2694,The Chromebooks being distributed were made possible in part by a donation from Google.,cambridge,Massachusetts
2695,"Scraping from https://www.cambridgema.gov/covid19/News/2020/08/newinitiativestostopspreadofcovid19 Baker-Polito Administration Announces New Initiatives to Stop Spread of COVID-19 August 07, 2020 Governor Charlie Baker announced a new set of initiatives aimed at stopping the spread of COVID-19 in Massachusetts, especially in higher risk communities that have seen a recent uptick in cases.",cambridge,Massachusetts
2696,"While Massachusetts has seen a decrease in COVID-19 cases and hospitalizations since May, there has been a slight uptick in certain communities in recent days.",cambridge,Massachusetts
2697,"Today, the Administration announced a set of initiatives, including stricter statewide rules for public and private gatherings and targeted community guidance.",cambridge,Massachusetts
2698,"The Administration also announced that, starting next week, additional reporting for town-by-town data will be published weekly to show the spread of COVID-19 at a community level.",cambridge,Massachusetts
2699,"Additionally, previously announced free COVID-19 testing in 17 communities has been extended through September 12.",cambridge,Massachusetts
2700,"Statewide Guidance: Governor Baker is signing an updated gatherings order, effective Tuesday, August 11, which will: Reduce the limit on outdoor gatherings from 100 to 50 people (indoor gatherings limit will remain at 25 people) Apply these limits to all types of gatherings, on both public and private property Require face coverings where more than 10 people from different households will be mixing.",cambridge,Massachusetts
2701,"Due to the recent increase in positive cases, step two of phase III of the Commonwealth’s reopening plan has been postponed indefinitely.",cambridge,Massachusetts
2702,Restaurant rules have been updated to state that alcoholic beverages may only be served for on-site consumption if accompanied by orders for food prepared on-site.,cambridge,Massachusetts
2703,The administration will be taking measures to ensure that bars masquerading as restaurants will be closed.,cambridge,Massachusetts
2704,"Public safety officials, including state and local law enforcement, have the jurisdiction to enforce these orders and event hosts in violation of these orders will be subject to fines or cease and desist orders.",cambridge,Massachusetts
2705,"To read the gatherings order, click here.",cambridge,Massachusetts
2706,"To read the updated restaurant protocols, click here.",cambridge,Massachusetts
2707,Cross-Agency COVID Enforcement and Intervention Team: The Administration also announced a targeted cross-agency COVID Enforcement and Intervention Team that will be responsible for ramping up enforcement statewide and coordinating local intervention efforts at the local level in higher risk COVID-19 communities.,cambridge,Massachusetts
2708,"Communities will be designated as higher risk COVID-19 communities based on public health data, including but not limited to rising trends for new cases and the percentage of positive COVID tests.",cambridge,Massachusetts
2709,"Member agencies include the Executive Office and Public Safety and Security (EOPSS) and the Massachusetts Emergency Management Agency (MEMA), who will serve as coordinators of the team, the Command Center, the Massachusetts State Police (MSP), the Department of Labor Standards (DLS), the Division of Professional Licensure (DPL), the Department of Public Health (DPH), the Division of Local Services (DLS), the Alcoholic Beverages Control Commission (ABCC) and the Executive Office of Technology Services and Security (EOTSS).",cambridge,Massachusetts
2710,"Stop the Spread: Last month, the Administration launched the Stop the Spread initiative, which provides free testing to residents in targeted communities throughout the Commonwealth.",cambridge,Massachusetts
2711,"There are currently sites in 17 communities: Agawam, Brockton, Chelsea, Everett, Fall River, Framingham, Lawrence, Lowell, Lynn, Marlborough, Methuen, New Bedford, Randolph, Revere, Springfield, Taunton, and Worcester.",cambridge,Massachusetts
2712,"The initiative is a data-driven focused effort to reduce the prevalence of COVID-19 in communities that are above the state average in total cases, positive test rate, and have experienced a decline in testing levels since April.",cambridge,Massachusetts
2713,These sites are open to all residents of the Commonwealth.,cambridge,Massachusetts
2714,"Today, the Administration announced the extension of free testing in these 17 communities through September 12.",cambridge,Massachusetts
2715,"Statewide Enforcement and Intervention will include: Targeted interventions and inspections by a range of member agencies, including Local Services, Labor Standards, DPH, MSP and ABCC, coordinated by EOPSS and MEMA.",cambridge,Massachusetts
2716,"Increased enforcement, including fines, of sector guidance for businesses to ensure businesses and residents are aware of and following COVID-19 orders.",cambridge,Massachusetts
2717,Support for ABCC and local licensing boards in exercising their existing authority to fine restaurants or suspend or cancel liquor licenses when restaurants do not comply with required COVID-19 safety measures.,cambridge,Massachusetts
2718,"Targeted public messaging campaign to alert residents of higher risk COVID communities (road signs, PSAs, etc.).",cambridge,Massachusetts
2719,Technical support to local government officials to support enhanced local COVID-19 prevention efforts such as assistance in accessing CARES Act funding.,cambridge,Massachusetts
2720,"Potential restrictions or shutdowns for parks, playgrounds, businesses or other entities and locations believed to be contributing to the COVID-19 spread in higher risk COVID-19 communities.",cambridge,Massachusetts
2721,"Additional resources for public health support such as testing, tracing and quarantining.",cambridge,Massachusetts
2722,For more information click here.,cambridge,Massachusetts
2723,"Scraping from https://www.cambridgema.gov/covid19/News/2020/08/newinitiativestostopspreadofcovid19 Baker-Polito Administration Announces New Initiatives to Stop Spread of COVID-19 August 07, 2020 Governor Charlie Baker announced a new set of initiatives aimed at stopping the spread of COVID-19 in Massachusetts, especially in higher risk communities that have seen a recent uptick in cases.",cambridge,Massachusetts
2724,"While Massachusetts has seen a decrease in COVID-19 cases and hospitalizations since May, there has been a slight uptick in certain communities in recent days.",cambridge,Massachusetts
2725,"Today, the Administration announced a set of initiatives, including stricter statewide rules for public and private gatherings and targeted community guidance.",cambridge,Massachusetts
2726,"The Administration also announced that, starting next week, additional reporting for town-by-town data will be published weekly to show the spread of COVID-19 at a community level.",cambridge,Massachusetts
2727,"Additionally, previously announced free COVID-19 testing in 17 communities has been extended through September 12.",cambridge,Massachusetts
2728,"Statewide Guidance: Governor Baker is signing an updated gatherings order, effective Tuesday, August 11, which will: Reduce the limit on outdoor gatherings from 100 to 50 people (indoor gatherings limit will remain at 25 people) Apply these limits to all types of gatherings, on both public and private property Require face coverings where more than 10 people from different households will be mixing.",cambridge,Massachusetts
2729,"Due to the recent increase in positive cases, step two of phase III of the Commonwealth’s reopening plan has been postponed indefinitely.",cambridge,Massachusetts
2730,Restaurant rules have been updated to state that alcoholic beverages may only be served for on-site consumption if accompanied by orders for food prepared on-site.,cambridge,Massachusetts
2731,The administration will be taking measures to ensure that bars masquerading as restaurants will be closed.,cambridge,Massachusetts
2732,"Public safety officials, including state and local law enforcement, have the jurisdiction to enforce these orders and event hosts in violation of these orders will be subject to fines or cease and desist orders.",cambridge,Massachusetts
2733,"To read the gatherings order, click here.",cambridge,Massachusetts
2734,"To read the updated restaurant protocols, click here.",cambridge,Massachusetts
2735,Cross-Agency COVID Enforcement and Intervention Team: The Administration also announced a targeted cross-agency COVID Enforcement and Intervention Team that will be responsible for ramping up enforcement statewide and coordinating local intervention efforts at the local level in higher risk COVID-19 communities.,cambridge,Massachusetts
2736,"Communities will be designated as higher risk COVID-19 communities based on public health data, including but not limited to rising trends for new cases and the percentage of positive COVID tests.",cambridge,Massachusetts
2737,"Member agencies include the Executive Office and Public Safety and Security (EOPSS) and the Massachusetts Emergency Management Agency (MEMA), who will serve as coordinators of the team, the Command Center, the Massachusetts State Police (MSP), the Department of Labor Standards (DLS), the Division of Professional Licensure (DPL), the Department of Public Health (DPH), the Division of Local Services (DLS), the Alcoholic Beverages Control Commission (ABCC) and the Executive Office of Technology Services and Security (EOTSS).",cambridge,Massachusetts
2738,"Stop the Spread: Last month, the Administration launched the Stop the Spread initiative, which provides free testing to residents in targeted communities throughout the Commonwealth.",cambridge,Massachusetts
2739,"There are currently sites in 17 communities: Agawam, Brockton, Chelsea, Everett, Fall River, Framingham, Lawrence, Lowell, Lynn, Marlborough, Methuen, New Bedford, Randolph, Revere, Springfield, Taunton, and Worcester.",cambridge,Massachusetts
2740,"The initiative is a data-driven focused effort to reduce the prevalence of COVID-19 in communities that are above the state average in total cases, positive test rate, and have experienced a decline in testing levels since April.",cambridge,Massachusetts
2741,These sites are open to all residents of the Commonwealth.,cambridge,Massachusetts
2742,"Today, the Administration announced the extension of free testing in these 17 communities through September 12.",cambridge,Massachusetts
2743,"Statewide Enforcement and Intervention will include: Targeted interventions and inspections by a range of member agencies, including Local Services, Labor Standards, DPH, MSP and ABCC, coordinated by EOPSS and MEMA.",cambridge,Massachusetts
2744,"Increased enforcement, including fines, of sector guidance for businesses to ensure businesses and residents are aware of and following COVID-19 orders.",cambridge,Massachusetts
2745,Support for ABCC and local licensing boards in exercising their existing authority to fine restaurants or suspend or cancel liquor licenses when restaurants do not comply with required COVID-19 safety measures.,cambridge,Massachusetts
2746,"Targeted public messaging campaign to alert residents of higher risk COVID communities (road signs, PSAs, etc.).",cambridge,Massachusetts
2747,Technical support to local government officials to support enhanced local COVID-19 prevention efforts such as assistance in accessing CARES Act funding.,cambridge,Massachusetts
2748,"Potential restrictions or shutdowns for parks, playgrounds, businesses or other entities and locations believed to be contributing to the COVID-19 spread in higher risk COVID-19 communities.",cambridge,Massachusetts
2749,"Additional resources for public health support such as testing, tracing and quarantining.",cambridge,Massachusetts
2750,For more information click here.,cambridge,Massachusetts
2751,"Scraping from https://www.cpsd.us/cms/One.aspx?portalId=3042869&pageId=69640954 Update on Reopening of Schools: August 7, 2020 Scraping from https://www.cambridgema.gov/covid19/Testing Testing There are several ways that Cambridge residents can get tested for COVID-19.",cambridge,Massachusetts
2752,"The sites listed below are offering viral tests, which tell you if you have a current infection.",cambridge,Massachusetts
2753,"Viral testing is covered by insurance and, in some instances, is being offered for free, depending on the site.",cambridge,Massachusetts
2754,Mobile Testing The Cambridge Public Health Department (CPHD) is offering free mobile testing for Cambridge residents 8 years and older.,cambridge,Massachusetts
2755,"UPDATE - August 21 Cambridge Public Health Department is expanding its mobile testing for the month of August, providing additional testing slots next week at the King Open School.",cambridge,Massachusetts
2756,"Other Mobile Testing Sites: King Open School (850 Cambridge Street), will offer testing on Monday, August 24; Tuesday, August 25; Thursday, August 26; and Friday, August 27 from 10 a.m. to 6 p.m. Field House at Russell Field (Rindge Ave) will offer testing on Wednesday, August 26 from 10 a.m. - 6 p.m.",cambridge,Massachusetts
2757,"The Pisani Center (131 Washington St) will offer testing on Saturday, August 22 and Saturday, August 29 from 11 a.m. - 7 p.m. We will be increasing testing capacity throughout the month of August.",cambridge,Massachusetts
2758,"To schedule an appointment, call 617-665-3795 or sign-up online at https://covid-test.appointlet.com/s/cambridge No identification or Social Security Number is required.",cambridge,Massachusetts
2759,Testing is for Cambridge residents only.,cambridge,Massachusetts
2760,"If you're not a Cambridge resident, please call your local board of health to find out where you can get tested in your city or town.",cambridge,Massachusetts
2761,Test Results The Cambridge Public Health Department (CPHD) shares results with residents who receive testing at a mobile site or CHA stand-alone testing center.,cambridge,Massachusetts
2762,Mobile Testing: Test results are typically available within 2 days on the online patient portal.,cambridge,Massachusetts
2763,Residents receive an email alerting them when results are ready on the portal.,cambridge,Massachusetts
2764,"The health department also notifies Cambridge residents of their results by phone, typically within 3 business days of receiving them.",cambridge,Massachusetts
2765,"To find out the status of your test results, leave a message at 617-665-3848 and you will receive a call back.",cambridge,Massachusetts
2766,"Other Ways to Get Tested If you are not a Cambridge resident or cannot access the Cambridge testing sites, there are several ways you can gain access to testing: Cambridge Health Alliance (CHA) CHA's new testing location is at 133 Middlesex Ave. in Somerville (Assembly Square).",cambridge,Massachusetts
2767,"It is open to CHA patients and community members in their service areas (Cambridge, Chelsea, Everett, Malden, Medford, Revere, Somerville and Winthrop).",cambridge,Massachusetts
2768,"It runs Monday-Friday from 9 a.m. - 4 p.m. You must have an appointment -- please call 617-665-2928 (Mon-Fri, 8:30 a.m. - 4 p.m.).",cambridge,Massachusetts
2769,"You can come by car, by bicycle, or on foot.",cambridge,Massachusetts
2770,Please bring a picture ID.,cambridge,Massachusetts
2771,More information is available on CHA's website.,cambridge,Massachusetts
2772,CHA has set up a voice mailbox (617-665-1102) to answer questions or concerns about COVID-19 test results.,cambridge,Massachusetts
2773,"Callers are asked to leave their name, date of birth and phone number for a call back.",cambridge,Massachusetts
2774,CHA will respond within one business day.,cambridge,Massachusetts
2775,"The mailbox is open to community members who have been tested at CHA, including patients, residents and first responders.",cambridge,Massachusetts
2776,Any CHA providers or staff members with testing questions should call CHA Occupational Health at 617-591-4660.,cambridge,Massachusetts
2777,"Contact Your Health Care Provider If you think you may have COVID-19, call your health care provider and tell them about your symptoms.",cambridge,Massachusetts
2778,"COVID-19 symptoms may include fever, sore throat, loss of sense of smell, cough, difficulty breathing, body aches, or chills.",cambridge,Massachusetts
2779,Your health care provider will help you decide whether testing is appropriate.,cambridge,Massachusetts
2780,"If your provider thinks you should be tested and cannot do the test on-site, they will make the referral to a testing site near you.",cambridge,Massachusetts
2781,Here is a current list of COVID-19 testing sites in Massachusetts: https://www.mass.gov/doc/ma-covid-19-testing-sites/download Use the State’s Free Online Telehealth Service The state is partnering with Doctor on Demand to offer free telehealth visits to Massachusetts residents who want to get a quick assessment of symptoms and/or do not have health insurance.,cambridge,Massachusetts
2782,"Through this service, you’ll be evaluated online and connected to testing if needed.",cambridge,Massachusetts
2783,"To access this free service, go to: https://www.mass.gov/how-to/check-your-symptoms-for-covid-19-online Call the State’s 24-Hour Hotline If you do not have internet access or do not feel comfortable using websites, you can call 2-1-1, a 24-hour state-supported telephone hotline.",cambridge,Massachusetts
2784,Hotline staff can provide guidance on testing.,cambridge,Massachusetts
2785,"Resources Massachusetts COVID-19 testing page (Mass.gov) COVID-19 Test Site Locator tool Scraping from https://www.cambridgema.gov/news/detail.aspx?path=/sitecore/content/home/cpl/aboutus/newsandannouncements/2020/08/kidsbookstogo Kids Books to Go August 06, 2020 Cambridge, MA, August 6 – The next event of Kids Books to Go, a new initiative launched by the Cambridge Public Library to help young people in Cambridge access physical library books this summer, will take place on Saturday, August 8, from 1-4 p.m., outside the Valente Branch, at 826 Cambridge Street.",cambridge,Massachusetts
2786,"Since its inception in July 2020, 665 bags containing 3-5 books each have been distributed to 1,091 community members at events held in library branch locations.",cambridge,Massachusetts
2787,"The program’s success was highlighted by Publisher’s Weekly Children’s Bookshelf on July 30, 2020.",cambridge,Massachusetts
